<?xml version="1.0" encoding="UTF-8"?>
<!-- This is a preliminary draft version! -->
<!-- Rezilla project -->
<!-- Author: Bernard Desgraupes -->
<!-- E-mail: bdesgraupes@users.sourceforge.net -->
<!-- Web: http://webperso.easyconnect.fr/bdesgraupes/rezilla.html -->
<!-- $Revision$ -->
<!-- $Date$ -->
<!DOCTYPE AETEREZ SYSTEM "file://localhost/System/Library/DTDs/aete.dtd">

<AETEREZ>
<aeteRezNum>0</aeteRezNum>
<aeteRezTitle>Scripting terminology</aeteRezTitle>
<MajorVersion>0x1</MajorVersion>
<MinorVersion>0x0</MinorVersion>
<LanguageCode>0</LanguageCode>
<ScriptCode>0</ScriptCode>

<ArraySuites>
	<Suite>
	<SuiteName>Required Suite</SuiteName>       	
	<SuiteDescription>Terms that every application should support</SuiteDescription>	
	<SuiteID>reqd</SuiteID>         	
	<SuiteLevel>1</SuiteLevel>      	
	<SuiteVersion>1</SuiteVersion>    
		<ArrayEvents>
		</ArrayEvents>

		<ArrayClasses>
		</ArrayClasses>

		<ArrayComparisonOps>
		</ArrayComparisonOps>

		<ArrayEnumerations>
		</ArrayEnumerations>
	</Suite>

	<Suite>
	<SuiteName>Standard Suite</SuiteName>
	<SuiteDescription>Common terms for most applications</SuiteDescription>
	<SuiteID>CoRe</SuiteID>
	<SuiteLevel>1</SuiteLevel>
	<SuiteVersion>1</SuiteVersion>
		<ArrayEvents>
			<Event>
				<EventName>close</EventName>
				<EventDescription>Close an object</EventDescription>
				<EventClass>core</EventClass>
				<EventID>clos</EventID>
				<ReplyDirectParamType>null</ReplyDirectParamType>
				<ReplyDirectParamDescription></ReplyDirectParamDescription>
				<IsReplyRequired>replyOptional</IsReplyRequired>
				<IsReplyList>singleItem</IsReplyList>
				<IsReplyEnumerated>notEnumerated</IsReplyEnumerated>
				<HasTightBindingPrecedence>notTightBindingFunction</HasTightBindingPrecedence>
				<EnumConstantOrType>enumsAreConstants</EnumConstantOrType>
				<CanEnumListRepeat>enumListCanRepeat</CanEnumListRepeat>
				<ReplyIsValueOrRef>replyIsValue</ReplyIsValueOrRef>
				<Reserved/>
				<Reserved/>
				<Reserved/>
				<Reserved/>
				<Reserved/>
				<IsVerbEvent>verbEvent</IsVerbEvent>
				<Reserved/>
				<Reserved/>
				<Reserved/>
				<DirectParamType>obj </DirectParamType>
				<DirectParmDescription>the objects to close</DirectParmDescription>
				<IsDirectParamRequired>directParamRequired</IsDirectParamRequired>
				<IsDirectParamList>singleItem</IsDirectParamList>
				<IsDirectParamEnumerated>notEnumerated</IsDirectParamEnumerated>
				<ChangeState>changesState</ChangeState>
				<EnumConstantOrType>enumsAreConstants</EnumConstantOrType>
				<CanEnumListRepeat>enumListCanRepeat</CanEnumListRepeat>
				<DirectParamIsValueOrRef>directParamIsValue</DirectParamIsValueOrRef>
				<IsDirectParamTarget>directParamIsTarget</IsDirectParamTarget>
				<Reserved/>
				<Reserved/>
				<Reserved/>
				<Reserved/>
				<Reserved/>
				<Reserved/>
				<Reserved/>
				<Reserved/>
				<ArrayOtherParams>
					<OtherParam>
						<OtherParamName>saving</OtherParamName>
						<OtherParamKeyword>savo</OtherParamKeyword>
						<OtherParamType>savo</OtherParamType>
						<OtherParamDescription>specifies whether or not changes should be saved before closing</OtherParamDescription>
						<IsOtherParamRequired>optional</IsOtherParamRequired>
						<IsOtherParamList>singleItem</IsOtherParamList>
						<IsOtherParamEnumerated>enumerated</IsOtherParamEnumerated>
						<Reserved/>
						<EnumConstantOrType>enumsAreConstants</EnumConstantOrType>
						<CanEnumListRepeat>enumListCanRepeat</CanEnumListRepeat>
						<OtherParamIsValueOrRef>paramIsValue</OtherParamIsValueOrRef>
						<IsOtherParamTarget>notParamIsTarget</IsOtherParamTarget>
						<Reserved/>
						<Reserved/>
						<Reserved/>
						<Reserved/>
						<PrepositionOrLabeled>prepositionParam</PrepositionOrLabeled>
						<IsFeminine>notFeminine</IsFeminine>
						<IsMasculine>notMasculine</IsMasculine>
						<SingularOrPlural>singular</SingularOrPlural>
					</OtherParam>
					<OtherParam>
						<OtherParamName>in</OtherParamName>
						<OtherParamKeyword>kfil</OtherParamKeyword>
						<OtherParamType>alis</OtherParamType>
						<OtherParamDescription>the file in which to save the object</OtherParamDescription>
						<IsOtherParamRequired>optional</IsOtherParamRequired>
						<IsOtherParamList>singleItem</IsOtherParamList>
						<IsOtherParamEnumerated>notEnumerated</IsOtherParamEnumerated>
						<Reserved/>
						<EnumConstantOrType>enumsAreConstants</EnumConstantOrType>
						<CanEnumListRepeat>enumListCanRepeat</CanEnumListRepeat>
						<OtherParamIsValueOrRef>paramIsValue</OtherParamIsValueOrRef>
						<IsOtherParamTarget>notParamIsTarget</IsOtherParamTarget>
						<Reserved/>
						<Reserved/>
						<Reserved/>
						<Reserved/>
						<PrepositionOrLabeled>prepositionParam</PrepositionOrLabeled>
						<IsFeminine>notFeminine</IsFeminine>
						<IsMasculine>notMasculine</IsMasculine>
						<SingularOrPlural>singular</SingularOrPlural>
					</OtherParam>
				</ArrayOtherParams>
			</Event>

			<Event>
				<EventName>count</EventName>
				<EventDescription>Return the number of elements of a particular class within an object</EventDescription>
				<EventClass>core</EventClass>
				<EventID>cnte</EventID>
				<ReplyDirectParamType>long</ReplyDirectParamType>
				<ReplyDirectParamDescription>the number of elements</ReplyDirectParamDescription>
				<IsReplyRequired>replyRequired</IsReplyRequired>
				<IsReplyList>singleItem</IsReplyList>
				<IsReplyEnumerated>notEnumerated</IsReplyEnumerated>
				<HasTightBindingPrecedence>notTightBindingFunction</HasTightBindingPrecedence>
				<EnumConstantOrType>enumsAreConstants</EnumConstantOrType>
				<CanEnumListRepeat>enumListCanRepeat</CanEnumListRepeat>
				<ReplyIsValueOrRef>replyIsValue</ReplyIsValueOrRef>
				<Reserved/>
				<Reserved/>
				<Reserved/>
				<Reserved/>
				<Reserved/>
				<IsVerbEvent>verbEvent</IsVerbEvent>
				<Reserved/>
				<Reserved/>
				<Reserved/>
				<DirectParamType>obj </DirectParamType>
				<DirectParmDescription>the object whose elements are to be counted</DirectParmDescription>
				<IsDirectParamRequired>directParamRequired</IsDirectParamRequired>
				<IsDirectParamList>singleItem</IsDirectParamList>
				<IsDirectParamEnumerated>notEnumerated</IsDirectParamEnumerated>
				<ChangeState>doesntChangeState</ChangeState>
				<EnumConstantOrType>enumsAreConstants</EnumConstantOrType>
				<CanEnumListRepeat>enumListCanRepeat</CanEnumListRepeat>
				<DirectParamIsValueOrRef>directParamIsValue</DirectParamIsValueOrRef>
				<IsDirectParamTarget>directParamIsTarget</IsDirectParamTarget>
				<Reserved/>
				<Reserved/>
				<Reserved/>
				<Reserved/>
				<Reserved/>
				<Reserved/>
				<Reserved/>
				<Reserved/>
				<ArrayOtherParams>
					<OtherParam>
						<OtherParamName>each</OtherParamName>
						<OtherParamKeyword>kocl</OtherParamKeyword>
						<OtherParamType>type</OtherParamType>
						<OtherParamDescription>the class of the elements to be counted</OtherParamDescription>
						<IsOtherParamRequired>required</IsOtherParamRequired>
						<IsOtherParamList>singleItem</IsOtherParamList>
						<IsOtherParamEnumerated>notEnumerated</IsOtherParamEnumerated>
						<Reserved/>
						<EnumConstantOrType>enumsAreConstants</EnumConstantOrType>
						<CanEnumListRepeat>enumListCanRepeat</CanEnumListRepeat>
						<OtherParamIsValueOrRef>paramIsValue</OtherParamIsValueOrRef>
						<IsOtherParamTarget>notParamIsTarget</IsOtherParamTarget>
						<Reserved/>
						<Reserved/>
						<Reserved/>
						<Reserved/>
						<PrepositionOrLabeled>prepositionParam</PrepositionOrLabeled>
						<IsFeminine>notFeminine</IsFeminine>
						<IsMasculine>notMasculine</IsMasculine>
						<SingularOrPlural>singular</SingularOrPlural>
					</OtherParam>
				</ArrayOtherParams>
			</Event>

			<Event>
				<EventName>data size</EventName>
				<EventDescription>Return the size in bytes of an object</EventDescription>
				<EventClass>core</EventClass>
				<EventID>dsiz</EventID>
				<ReplyDirectParamType>long</ReplyDirectParamType>
				<ReplyDirectParamDescription>the size of the object in bytes</ReplyDirectParamDescription>
				<IsReplyRequired>replyRequired</IsReplyRequired>
				<IsReplyList>singleItem</IsReplyList>
				<IsReplyEnumerated>notEnumerated</IsReplyEnumerated>
				<HasTightBindingPrecedence>notTightBindingFunction</HasTightBindingPrecedence>
				<EnumConstantOrType>enumsAreConstants</EnumConstantOrType>
				<CanEnumListRepeat>enumListCanRepeat</CanEnumListRepeat>
				<ReplyIsValueOrRef>replyIsValue</ReplyIsValueOrRef>
				<Reserved/>
				<Reserved/>
				<Reserved/>
				<Reserved/>
				<Reserved/>
				<IsVerbEvent>verbEvent</IsVerbEvent>
				<Reserved/>
				<Reserved/>
				<Reserved/>
				<DirectParamType>obj </DirectParamType>
				<DirectParmDescription>the object whose data size is to be returned</DirectParmDescription>
				<IsDirectParamRequired>directParamRequired</IsDirectParamRequired>
				<IsDirectParamList>singleItem</IsDirectParamList>
				<IsDirectParamEnumerated>notEnumerated</IsDirectParamEnumerated>
				<ChangeState>doesntChangeState</ChangeState>
				<EnumConstantOrType>enumsAreConstants</EnumConstantOrType>
				<CanEnumListRepeat>enumListCanRepeat</CanEnumListRepeat>
				<DirectParamIsValueOrRef>directParamIsValue</DirectParamIsValueOrRef>
				<IsDirectParamTarget>directParamIsTarget</IsDirectParamTarget>
				<Reserved/>
				<Reserved/>
				<Reserved/>
				<Reserved/>
				<Reserved/>
				<Reserved/>
				<Reserved/>
				<Reserved/>
				<ArrayOtherParams>
				</ArrayOtherParams>
			</Event>

			<Event>
				<EventName>exists</EventName>
				<EventDescription>Verify if an object exists</EventDescription>
				<EventClass>core</EventClass>
				<EventID>doex</EventID>
				<ReplyDirectParamType>bool</ReplyDirectParamType>
				<ReplyDirectParamDescription>true if it exists, false if not</ReplyDirectParamDescription>
				<IsReplyRequired>replyRequired</IsReplyRequired>
				<IsReplyList>singleItem</IsReplyList>
				<IsReplyEnumerated>notEnumerated</IsReplyEnumerated>